{
  "title": "data/themes.json",
  "$schema": "https://json-schema.org/draft/2020-12/schema",
  "type": "array",
  "items": {
    "type": "object",
    "properties": {
      "id": {
        "type": "string",
        "pattern": "^[a-z0-9]+(?:-[a-z0-9]+)*$"
      },
      "label": {
        "type": "object",
        "properties": {
          "en": {
            "type": "string",
            "minLength": 1
          },
          "ur": {
            "type": "string",
            "minLength": 1
          }
        },
        "required": ["en", "ur"]
      },
      "category": {
        "type": "string",
        "pattern": "^[a-z0-9]+(?:-[a-z0-9]+)*$"
      },
      "description": {
        "type": "string",
        "minLength": 1
      },
      "order": {
        "type": "integer",
        "exclusiveMinimum": 0,
        "maximum": 9007199254740991
      }
    },
    "required": ["id", "label", "category", "description", "order"]
  }
}
