[
  {
    "id": "tawheed",
    "label": {
      "en": "Tawheed",
      "ur": "توحید"
    },
    "category": "belief",
    "description": "Oneness of Allah — His lordship, sole right to worship & uniqueness",
    "order": 1
  },
  {
    "id": "asma-ul-husna",
    "label": {
      "en": "Asma ul Husna",
      "ur": "اسماء الحسنیٰ"
    },
    "category": "belief",
    "description": "Names & attributes of Allah",
    "order": 2
  },
  {
    "id": "rahmah",
    "label": {
      "en": "Mercy & Forgiveness",
      "ur": "رحمت و مغفرت"
    },
    "category": "belief",
    "description": "Allah's vast mercy, forgiveness & kindness to His servants",
    "order": 3
  },
  {
    "id": "iman",
    "label": {
      "en": "Iman",
      "ur": "ایمان"
    },
    "category": "belief",
    "description": "Faith, its pillars & the qualities of true believers",
    "order": 4
  },
  {
    "id": "shirk",
    "label": {
      "en": "Shirk",
      "ur": "شرک"
    },
    "category": "belief",
    "description": "Associating partners with Allah — idols, false gods & their refutation",
    "order": 5
  },
  {
    "id": "kufr",
    "label": {
      "en": "Kufr",
      "ur": "کفر"
    },
    "category": "belief",
    "description": "Disbelief, denial of the truth & the attitudes of the disbelievers",
    "order": 6
  },
  {
    "id": "nifaq",
    "label": {
      "en": "Nifaq",
      "ur": "نفاق"
    },
    "category": "belief",
    "description": "Hypocrisy — the hypocrites' traits, schemes & exposure",
    "order": 7
  },
  {
    "id": "hidayah",
    "label": {
      "en": "Guidance",
      "ur": "ہدایت و ضلالت"
    },
    "category": "belief",
    "description": "Guidance & misguidance — how and why hearts are guided or led astray",
    "order": 8
  },
  {
    "id": "qadr",
    "label": {
      "en": "Qadr",
      "ur": "تقدیر"
    },
    "category": "belief",
    "description": "Divine decree, Allah's will & destiny",
    "order": 9
  },
  {
    "id": "prophethood",
    "label": {
      "en": "Prophethood",
      "ur": "نبوت و رسالت"
    },
    "category": "belief",
    "description": "The messengers — their mission, humanity & belief in all of them",
    "order": 10
  },
  {
    "id": "revelation",
    "label": {
      "en": "Revelation",
      "ur": "وحی و کتب"
    },
    "category": "belief",
    "description": "Wahy — the Quran's divine origin, earlier scriptures & the challenge to imitate it",
    "order": 11
  },
  {
    "id": "angels",
    "label": {
      "en": "Angels",
      "ur": "ملائکہ"
    },
    "category": "belief",
    "description": "Angels — their nature, duties & the unseen world",
    "order": 12
  },
  {
    "id": "jinn",
    "label": {
      "en": "Jinn",
      "ur": "جنات"
    },
    "category": "belief",
    "description": "The jinn — their creation, believers & disbelievers among them",
    "order": 13
  },
  {
    "id": "shaytan",
    "label": {
      "en": "Shaytan",
      "ur": "شیطان"
    },
    "category": "belief",
    "description": "Iblis & the devils — enmity, whispers, deception & magic",
    "order": 14
  },
  {
    "id": "death-reminder",
    "label": {
      "en": "Death & the Grave",
      "ur": "موت و برزخ"
    },
    "category": "hereafter",
    "description": "Death, the barzakh & preparing to meet Allah",
    "order": 15
  },
  {
    "id": "resurrection",
    "label": {
      "en": "Resurrection",
      "ur": "بعث بعد الموت"
    },
    "category": "hereafter",
    "description": "Life after death — its proofs & answers to those who deny it",
    "order": 16
  },
  {
    "id": "akhirah",
    "label": {
      "en": "Akhirah & Judgment Day",
      "ur": "آخرت و یوم الحساب"
    },
    "category": "hereafter",
    "description": "The Hour, the Day of Judgment, reckoning, scales & intercession",
    "order": 17
  },
  {
    "id": "jannah",
    "label": {
      "en": "Jannah",
      "ur": "جنت"
    },
    "category": "hereafter",
    "description": "Paradise — its gardens, delights & people",
    "order": 18
  },
  {
    "id": "jahannam",
    "label": {
      "en": "Jahannam",
      "ur": "جہنم"
    },
    "category": "hereafter",
    "description": "Hell — its punishment & its people",
    "order": 19
  },
  {
    "id": "story-adam",
    "label": {
      "en": "Prophet Adam",
      "ur": "آدم علیہ السلام"
    },
    "category": "prophets",
    "description": "Creation of Adam, the angels' prostration, Iblis & repentance",
    "order": 20
  },
  {
    "id": "story-idris",
    "label": {
      "en": "Prophet Idris",
      "ur": "ادریس علیہ السلام"
    },
    "category": "prophets",
    "description": "A truthful prophet raised to a high station",
    "order": 21
  },
  {
    "id": "story-nuh",
    "label": {
      "en": "Prophet Nuh",
      "ur": "نوح علیہ السلام"
    },
    "category": "prophets",
    "description": "Centuries of da'wah, the ark & the flood",
    "order": 22
  },
  {
    "id": "story-hud",
    "label": {
      "en": "Prophet Hud",
      "ur": "ہود علیہ السلام"
    },
    "category": "prophets",
    "description": "The people of 'Ad, their might & the destroying wind",
    "order": 23
  },
  {
    "id": "story-salih",
    "label": {
      "en": "Prophet Salih",
      "ur": "صالح علیہ السلام"
    },
    "category": "prophets",
    "description": "Thamud, the she-camel & the mighty blast",
    "order": 24
  },
  {
    "id": "story-ibrahim",
    "label": {
      "en": "Prophet Ibrahim",
      "ur": "ابراہیم علیہ السلام"
    },
    "category": "prophets",
    "description": "Khalilullah — breaking the idols, the fire, the sacrifice & the Kaaba",
    "order": 25
  },
  {
    "id": "story-lut",
    "label": {
      "en": "Prophet Lut",
      "ur": "لوط علیہ السلام"
    },
    "category": "prophets",
    "description": "The people of Lut, their indecency & the overturned cities",
    "order": 26
  },
  {
    "id": "story-ismail",
    "label": {
      "en": "Prophet Ismail",
      "ur": "اسماعیل علیہ السلام"
    },
    "category": "prophets",
    "description": "The sacrifice, raising the Kaaba & true to his promise",
    "order": 27
  },
  {
    "id": "story-ishaq",
    "label": {
      "en": "Prophet Ishaq",
      "ur": "اسحاق علیہ السلام"
    },
    "category": "prophets",
    "description": "Glad tidings of a son to Ibrahim & Sarah in old age",
    "order": 28
  },
  {
    "id": "story-yaqub",
    "label": {
      "en": "Prophet Yaqub",
      "ur": "یعقوب علیہ السلام"
    },
    "category": "prophets",
    "description": "Beautiful patience in grief & his final counsel to his sons",
    "order": 29
  },
  {
    "id": "story-yusuf",
    "label": {
      "en": "Prophet Yusuf",
      "ur": "یوسف علیہ السلام"
    },
    "category": "prophets",
    "description": "The dream, the well, the prison, the palace & forgiveness",
    "order": 30
  },
  {
    "id": "story-ayyub",
    "label": {
      "en": "Prophet Ayyub",
      "ur": "ایوب علیہ السلام"
    },
    "category": "prophets",
    "description": "Illness, loss & patience rewarded",
    "order": 31
  },
  {
    "id": "story-shuayb",
    "label": {
      "en": "Prophet Shuayb",
      "ur": "شعیب علیہ السلام"
    },
    "category": "prophets",
    "description": "Madyan & Aykah — full measure & honest trade",
    "order": 32
  },
  {
    "id": "story-musa",
    "label": {
      "en": "Prophet Musa",
      "ur": "موسیٰ علیہ السلام"
    },
    "category": "prophets",
    "description": "Pharaoh, the exodus, the Torah & the journey with Khidr",
    "order": 33
  },
  {
    "id": "story-harun",
    "label": {
      "en": "Prophet Harun",
      "ur": "ہارون علیہ السلام"
    },
    "category": "prophets",
    "description": "Musa's brother, minister & fellow messenger",
    "order": 34
  },
  {
    "id": "story-dhulkifl",
    "label": {
      "en": "Prophet Dhul-Kifl",
      "ur": "ذوالکفل علیہ السلام"
    },
    "category": "prophets",
    "description": "Among the patient & the best",
    "order": 35
  },
  {
    "id": "story-dawud",
    "label": {
      "en": "Prophet Dawud",
      "ur": "داؤد علیہ السلام"
    },
    "category": "prophets",
    "description": "Victory over Jalut, kingship, the Zabur & repentance",
    "order": 36
  },
  {
    "id": "story-sulayman",
    "label": {
      "en": "Prophet Sulayman",
      "ur": "سلیمان علیہ السلام"
    },
    "category": "prophets",
    "description": "A kingdom over jinn & wind, the ant, the hoopoe & the Queen of Saba",
    "order": 37
  },
  {
    "id": "story-ilyas",
    "label": {
      "en": "Prophet Ilyas",
      "ur": "الیاس علیہ السلام"
    },
    "category": "prophets",
    "description": "Calling his people away from the idol Ba'l",
    "order": 38
  },
  {
    "id": "story-alyasa",
    "label": {
      "en": "Prophet Al-Yasa",
      "ur": "الیسع علیہ السلام"
    },
    "category": "prophets",
    "description": "Among the chosen & the best",
    "order": 39
  },
  {
    "id": "story-yunus",
    "label": {
      "en": "Prophet Yunus",
      "ur": "یونس علیہ السلام"
    },
    "category": "prophets",
    "description": "Leaving his people, the whale, the dua in the darkness & mercy",
    "order": 40
  },
  {
    "id": "story-zakariya",
    "label": {
      "en": "Prophet Zakariya",
      "ur": "زکریا علیہ السلام"
    },
    "category": "prophets",
    "description": "Guardian of Maryam — a quiet dua answered with Yahya",
    "order": 41
  },
  {
    "id": "story-yahya",
    "label": {
      "en": "Prophet Yahya",
      "ur": "یحییٰ علیہ السلام"
    },
    "category": "prophets",
    "description": "Given wisdom as a child — chaste, dutiful & at peace",
    "order": 42
  },
  {
    "id": "story-isa",
    "label": {
      "en": "Prophet Isa",
      "ur": "عیسیٰ علیہ السلام"
    },
    "category": "prophets",
    "description": "Miraculous birth, miracles, the disciples & being raised",
    "order": 43
  },
  {
    "id": "story-muhammad",
    "label": {
      "en": "Prophet Muhammad ﷺ",
      "ur": "محمد ﷺ"
    },
    "category": "prophets",